<?xml version="1.0" encoding="UTF-8"?>
<xs:schema xmlns:xs="http://www.w3.org/2001/XMLSchema">
  <xs:element name="superheroe">
    <xs:complexType>
      <xs:sequence>
        <xs:element name="nombre" type="xs:string"/>
        <xs:element name="amigo" type="amigosSuperheroe" minOccurs="0" maxOccurs="unbounded"/>
      </xs:sequence>
    </xs:complexType>
  </xs:element>
  
  
  <xs:complexType name="amigosSuperheroe">
    <xs:sequence>
      <xs:element name="amigoDeSuperheroe" type="textoNoVacio"/>
    </xs:sequence>
  </xs:complexType>  
  
  <xs:simpleType name="textoNoVacio">
    <xs:restriction base="xs:string">
      <xs:minLength value="1"/>
    </xs:restriction>
  </xs:simpleType>
</xs:schema>
